{
  "catalog_version": 1,
  "package": {
    "id": "org.tuskeros.examples.hello",
    "name": "Hello Tusker",
    "kind": "extension",
    "summary": "Metadata-only example entry for marketplace contract testing.",
    "license": "Apache-2.0",
    "categories": ["examples", "developer-tools"],
    "tags": ["starter", "sample"]
  },
  "publisher": {
    "id": "tuskeros-examples",
    "display_name": "TuskerOS Examples",
    "verified": false
  },
  "release": {
    "version": "0.1.0",
    "manifest_uri": "https://example.invalid/hello/manifest.json",
    "artifact_uri": "https://example.invalid/hello/hello-0.1.0.tar.zst",
    "sha256": "aaaaaaaaaaaaaaaaaaaaaaaaaaaaaaaaaaaaaaaaaaaaaaaaaaaaaaaaaaaaaaaa",
    "published_at": "2026-10-31T00:00:00Z"
  },
  "compatibility": {
    "tuskeros": {"min": "0.1.0", "max": "0.x"},
    "api": {"min": "1.0", "max": "1.x"}
  },
  "trust": {
    "review_status": "pending",
    "signature_status": "unverified"
  },
  "community": {
    "rating_average": 0,
    "rating_count": 0,
    "download_count": 0
  }
}
